{
  "schema": "historical-replay-manifest.v1",
  "sample_source": "HISTORICAL_REPLAY",
  "target_categories": [
    "STRONG_UPTREND",
    "STRONG_DOWNTREND",
    "TREND_PULLBACK",
    "RANGE",
    "REVERSAL",
    "HIGH_VOLATILITY",
    "LOW_VOLATILITY",
    "BREAKOUT_CONTINUATION",
    "FAKE_BREAKOUT",
    "LIQUIDATION_EVENT",
    "EVENT_DRIVEN",
    "WEEKEND_LOW_LIQUIDITY",
    "EXHAUSTION",
    "TREND_END"
  ],
  "windows": [
    {
      "window_id": "btc-strong_uptrend-unselected",
      "symbol": "BTC",
      "start": null,
      "end": null,
      "sampling_reason": "Select a documented STRONG_UPTREND window; category is sampling intent only.",
      "target_category": "STRONG_UPTREND",
      "analysis_regime_label": null,
      "source": null,
      "status": "NOT_SELECTED"
    },
    {
      "window_id": "btc-strong_downtrend-unselected",
      "symbol": "BTC",
      "start": null,
      "end": null,
      "sampling_reason": "Select a documented STRONG_DOWNTREND window; category is sampling intent only.",
      "target_category": "STRONG_DOWNTREND",
      "analysis_regime_label": null,
      "source": null,
      "status": "NOT_SELECTED"
    },
    {
      "window_id": "btc-trend_pullback-unselected",
      "symbol": "BTC",
      "start": null,
      "end": null,
      "sampling_reason": "Select a documented TREND_PULLBACK window; category is sampling intent only.",
      "target_category": "TREND_PULLBACK",
      "analysis_regime_label": null,
      "source": null,
      "status": "NOT_SELECTED"
    },
    {
      "window_id": "btc-range-unselected",
      "symbol": "BTC",
      "start": null,
      "end": null,
      "sampling_reason": "Select a documented RANGE window; category is sampling intent only.",
      "target_category": "RANGE",
      "analysis_regime_label": null,
      "source": null,
      "status": "NOT_SELECTED"
    },
    {
      "window_id": "btc-reversal-unselected",
      "symbol": "BTC",
      "start": null,
      "end": null,
      "sampling_reason": "Select a documented REVERSAL window; category is sampling intent only.",
      "target_category": "REVERSAL",
      "analysis_regime_label": null,
      "source": null,
      "status": "NOT_SELECTED"
    },
    {
      "window_id": "btc-high_volatility-unselected",
      "symbol": "BTC",
      "start": null,
      "end": null,
      "sampling_reason": "Select a documented HIGH_VOLATILITY window; category is sampling intent only.",
      "target_category": "HIGH_VOLATILITY",
      "analysis_regime_label": null,
      "source": null,
      "status": "NOT_SELECTED"
    },
    {
      "window_id": "btc-low_volatility-unselected",
      "symbol": "BTC",
      "start": null,
      "end": null,
      "sampling_reason": "Select a documented LOW_VOLATILITY window; category is sampling intent only.",
      "target_category": "LOW_VOLATILITY",
      "analysis_regime_label": null,
      "source": null,
      "status": "NOT_SELECTED"
    },
    {
      "window_id": "btc-breakout_continuation-unselected",
      "symbol": "BTC",
      "start": null,
      "end": null,
      "sampling_reason": "Select a documented BREAKOUT_CONTINUATION window; category is sampling intent only.",
      "target_category": "BREAKOUT_CONTINUATION",
      "analysis_regime_label": null,
      "source": null,
      "status": "NOT_SELECTED"
    },
    {
      "window_id": "btc-fake_breakout-unselected",
      "symbol": "BTC",
      "start": null,
      "end": null,
      "sampling_reason": "Select a documented FAKE_BREAKOUT window; category is sampling intent only.",
      "target_category": "FAKE_BREAKOUT",
      "analysis_regime_label": null,
      "source": null,
      "status": "NOT_SELECTED"
    },
    {
      "window_id": "btc-liquidation_event-unselected",
      "symbol": "BTC",
      "start": null,
      "end": null,
      "sampling_reason": "Select a documented LIQUIDATION_EVENT window; category is sampling intent only.",
      "target_category": "LIQUIDATION_EVENT",
      "analysis_regime_label": null,
      "source": null,
      "status": "NOT_SELECTED"
    },
    {
      "window_id": "btc-event_driven-unselected",
      "symbol": "BTC",
      "start": null,
      "end": null,
      "sampling_reason": "Select a documented EVENT_DRIVEN window; category is sampling intent only.",
      "target_category": "EVENT_DRIVEN",
      "analysis_regime_label": null,
      "source": null,
      "status": "NOT_SELECTED"
    },
    {
      "window_id": "btc-weekend_low_liquidity-unselected",
      "symbol": "BTC",
      "start": null,
      "end": null,
      "sampling_reason": "Select a documented WEEKEND_LOW_LIQUIDITY window; category is sampling intent only.",
      "target_category": "WEEKEND_LOW_LIQUIDITY",
      "analysis_regime_label": null,
      "source": null,
      "status": "NOT_SELECTED"
    },
    {
      "window_id": "btc-exhaustion-unselected",
      "symbol": "BTC",
      "start": null,
      "end": null,
      "sampling_reason": "Select a documented EXHAUSTION window; category is sampling intent only.",
      "target_category": "EXHAUSTION",
      "analysis_regime_label": null,
      "source": null,
      "status": "NOT_SELECTED"
    },
    {
      "window_id": "btc-trend_end-unselected",
      "symbol": "BTC",
      "start": null,
      "end": null,
      "sampling_reason": "Select a documented TREND_END window; category is sampling intent only.",
      "target_category": "TREND_END",
      "analysis_regime_label": null,
      "source": null,
      "status": "NOT_SELECTED"
    },
    {
      "window_id": "eth-strong_uptrend-unselected",
      "symbol": "ETH",
      "start": null,
      "end": null,
      "sampling_reason": "Select a documented STRONG_UPTREND window; category is sampling intent only.",
      "target_category": "STRONG_UPTREND",
      "analysis_regime_label": null,
      "source": null,
      "status": "NOT_SELECTED"
    },
    {
      "window_id": "eth-strong_downtrend-unselected",
      "symbol": "ETH",
      "start": null,
      "end": null,
      "sampling_reason": "Select a documented STRONG_DOWNTREND window; category is sampling intent only.",
      "target_category": "STRONG_DOWNTREND",
      "analysis_regime_label": null,
      "source": null,
      "status": "NOT_SELECTED"
    },
    {
      "window_id": "eth-trend_pullback-unselected",
      "symbol": "ETH",
      "start": null,
      "end": null,
      "sampling_reason": "Select a documented TREND_PULLBACK window; category is sampling intent only.",
      "target_category": "TREND_PULLBACK",
      "analysis_regime_label": null,
      "source": null,
      "status": "NOT_SELECTED"
    },
    {
      "window_id": "eth-range-unselected",
      "symbol": "ETH",
      "start": null,
      "end": null,
      "sampling_reason": "Select a documented RANGE window; category is sampling intent only.",
      "target_category": "RANGE",
      "analysis_regime_label": null,
      "source": null,
      "status": "NOT_SELECTED"
    },
    {
      "window_id": "eth-reversal-unselected",
      "symbol": "ETH",
      "start": null,
      "end": null,
      "sampling_reason": "Select a documented REVERSAL window; category is sampling intent only.",
      "target_category": "REVERSAL",
      "analysis_regime_label": null,
      "source": null,
      "status": "NOT_SELECTED"
    },
    {
      "window_id": "eth-high_volatility-unselected",
      "symbol": "ETH",
      "start": null,
      "end": null,
      "sampling_reason": "Select a documented HIGH_VOLATILITY window; category is sampling intent only.",
      "target_category": "HIGH_VOLATILITY",
      "analysis_regime_label": null,
      "source": null,
      "status": "NOT_SELECTED"
    },
    {
      "window_id": "eth-low_volatility-unselected",
      "symbol": "ETH",
      "start": null,
      "end": null,
      "sampling_reason": "Select a documented LOW_VOLATILITY window; category is sampling intent only.",
      "target_category": "LOW_VOLATILITY",
      "analysis_regime_label": null,
      "source": null,
      "status": "NOT_SELECTED"
    },
    {
      "window_id": "eth-breakout_continuation-unselected",
      "symbol": "ETH",
      "start": null,
      "end": null,
      "sampling_reason": "Select a documented BREAKOUT_CONTINUATION window; category is sampling intent only.",
      "target_category": "BREAKOUT_CONTINUATION",
      "analysis_regime_label": null,
      "source": null,
      "status": "NOT_SELECTED"
    },
    {
      "window_id": "eth-fake_breakout-unselected",
      "symbol": "ETH",
      "start": null,
      "end": null,
      "sampling_reason": "Select a documented FAKE_BREAKOUT window; category is sampling intent only.",
      "target_category": "FAKE_BREAKOUT",
      "analysis_regime_label": null,
      "source": null,
      "status": "NOT_SELECTED"
    },
    {
      "window_id": "eth-liquidation_event-unselected",
      "symbol": "ETH",
      "start": null,
      "end": null,
      "sampling_reason": "Select a documented LIQUIDATION_EVENT window; category is sampling intent only.",
      "target_category": "LIQUIDATION_EVENT",
      "analysis_regime_label": null,
      "source": null,
      "status": "NOT_SELECTED"
    },
    {
      "window_id": "eth-event_driven-unselected",
      "symbol": "ETH",
      "start": null,
      "end": null,
      "sampling_reason": "Select a documented EVENT_DRIVEN window; category is sampling intent only.",
      "target_category": "EVENT_DRIVEN",
      "analysis_regime_label": null,
      "source": null,
      "status": "NOT_SELECTED"
    },
    {
      "window_id": "eth-weekend_low_liquidity-unselected",
      "symbol": "ETH",
      "start": null,
      "end": null,
      "sampling_reason": "Select a documented WEEKEND_LOW_LIQUIDITY window; category is sampling intent only.",
      "target_category": "WEEKEND_LOW_LIQUIDITY",
      "analysis_regime_label": null,
      "source": null,
      "status": "NOT_SELECTED"
    },
    {
      "window_id": "eth-exhaustion-unselected",